codigo_de_barras;nome_produto;url_imagem;comprimento;largura;altura;dimensoes_unidade;peso;peso_unidade
7898700012200;ELG, EPB-MAX5BK, Headphone Sem Fio, Bluetooth 5.1 com Microfone, Wireless, Graves Marcantes, Fone com Alta Definição Sonora, Autonomia de Até 20h, Preto;https://m.media-amazon.com/images/I/51pLTnfjGjL.__AC_SX300_SY300_QL70_ML2_.jpg;30,8;26,4;7,9;cm;300;g
7898700012194;ELG, EPB-MAX5WH, Headphone Sem Fio, Bluetooth 5.1 com Microfone, Wireless, Graves Marcantes, Fone com Alta Definição Sonora, Autonomia de Até 20h, Branco;https://m.media-amazon.com/images/I/51M5wo1PagL.__AC_SX300_SY300_QL70_ML2_.jpg;35,9;30,6;7,7;cm;300;g
7899838838564;Smartogo Fone De Ouvido Bluetooth Preto - PH256;https://m.media-amazon.com/images/I/31H2g2upFwL.__AC_SX300_SY300_QL70_ML2_.jpg;12,6;5;3;cm;0,04;g
7899838838571;Smartogo Fone De Ouvido Bluetooth Branco - PH257;https://m.media-amazon.com/images/I/317NWFU+T2L._AC_SY300_SX300_.jpg;12,6;5;2,5;cm;10;g
7899838833316;Fone de Ouvido Pop Bluetooth P2 Preto Multi - PH246;https://m.media-amazon.com/images/I/91s62BMGhJL.__AC_SX300_SY300_QL70_ML2_.jpg;20,5;18;8;cm;300;g
7898555213760;Headset Gamer C3Tech PH-G11BK Sparrow Preto - Com Microfone Driver de 40mm Conector P2 3.5mm Áudio Stereo, Grande;https://m.media-amazon.com/images/I/51tsDVZ4zCL.__AC_SX300_SY300_QL70_ML2_.jpg;23,8;21;13;cm;420;g
7898149189983;Fone de Ouvido com Microfone Profissional Big Grafite P2 - PH031, Multilaser;https://m.media-amazon.com/images/I/61SESibhMBL.__AC_SX300_SY300_QL70_ML2_.jpg;23;23;23;cm;500;g
7898615159496;Fone de Ouvido Gamer - com LED e Microfone - PX 6 - Camuflado;https://m.media-amazon.com/images/I/51r0u0Ah1rL.__AC_SX300_SY300_QL70_ML2_.jpg;24,2;23,6;11;cm;490;g
7898554605573;;;20;20;9;cm;34;g
7898555214965;Fone Bluetooth 4.2, C3Tech, Ph-B600Bk, Preto;https://m.media-amazon.com/images/I/71OTBlkPMRL.__AC_SX300_SY300_QL70_ML2_.jpg;20,6;16,8;7,4;cm;160;g
7898555219731;C3Tech Fone de ouvido Intra EP-07BK Preto com microfone integrado funcao Handsfree;https://m.media-amazon.com/images/I/31T6Yo5d-tL.__AC_SX300_SY300_QL70_ML2_.jpg;17;7,8;2,4;cm;14;g
7898555212817;Fone de Ouvido Intra Spirit, C3Tech, 410030580200, Branco;https://m.media-amazon.com/images/I/41qDTe54FWL.__AC_SX300_SY300_QL70_ML2_.jpg;16,8;7,8;2,2;cm;13;g
7899838806952;Fone de Ouvido, Multilaser, Multicor;https://m.media-amazon.com/images/I/51DwZ4lm0+L._AC_SY300_SX300_.jpg;11,8;3;2,2;cm;0,03;g
7898587271073;Fone free tws10, Conexão Bluetooth;https://m.media-amazon.com/images/I/51cirhN0g0L.__AC_SX300_SY300_QL70_ML2_.jpg;17,8;9;3,8;cm;200;g
7899838801728;Headset Gamer Multilaser P2 Preto/Vermelho - PH120;https://m.media-amazon.com/images/I/41D0dAShTAL.__AC_SX300_SY300_QL70_ML2_.jpg;21,4;19,2;10,8;cm;330;g
7899744089173;5+ Fone de Ouvido com Microfone Intra-Auricular In Ear, Cabo 1,2m Conexão USB-C, Tipo C, Type-C 5+ Branco;https://m.media-amazon.com/images/I/61DkUfjvmtL.__AC_SX300_SY300_QL70_ML2_.jpg;19;7,8;2,4;cm;40;g
7899744089166;5+ Fone de Ouvido com Microfone Intra-Auricular In Ear, Cabo 1,2m Conexão USB-C, Tipo C, Type-C 5+ Preto;https://m.media-amazon.com/images/I/61-iv+NERFL._AC_SY300_SX300_.jpg;18,8;7,6;2,6;cm;40;g
7899838876160;;;8,8;19,4;18;cm;323;g
7899831310142;WAAW by ALOK Fone de Ouvido VIB 100EW com Fio de 1,2 Metros, Intra-Auricular, Microfone Integrado, Controle Multifunções;https://m.media-amazon.com/images/I/612151jcRRL.__AC_SX300_SY300_QL70_ML2_.jpg;11;11;3;cm;12;g
7898555219779;C3TEch Fone de ouvido Intra EP-07WH Branco com microfone integrado funcao Handsfree;https://m.media-amazon.com/images/I/31FzL5b+msL._AC_SY300_SX300_.jpg;17,6;7,8;2,4;cm;14;g
7899831311620;WAAW by ALOK Fone de Ouvido Gamer ENERGY 10EWG com Fio, Intra-Auricular, Microfone Extra Destacável, Case de Transporte;https://m.media-amazon.com/images/I/71QLvHdTTOL.__AC_SX300_SY300_QL70_ML2_.jpg;19;11;5,2;cm;160;g
7898554606402;Fonte ATX 500W PFC Ativo Black Hawk 80 Plus Bronze Fortrek;https://m.media-amazon.com/images/I/71KaGUjHkPL.__AC_SX300_SY300_QL70_ML2_.jpg;42,2;21,2;15,2;cm;1,45;kg
7898506462070;Fonte para Gabinete ATX 200W Real Bulk Multi - GA114BU;https://m.media-amazon.com/images/I/71T94lhjWSS.__AC_SX300_SY300_QL70_ML2_.jpg;17,4;15;8,2;cm;800;g
7898555212916;Fonte Atx 200W, C3Tech, Acessórios para Computador;https://m.media-amazon.com/images/I/614jygAjSeL.__AC_SX300_SY300_QL70_ML2_.jpg;16,2;16,2;8,4;cm;680;g
7899838838625;Fonte ATX 200W sem cabo Multilaser Bulk sem Cabo Ventoinha De 8cm - GA200BU, Multilaser, GA200BU GA200BU;https://m.media-amazon.com/images/I/51SMJFd8gHL.__AC_SX300_SY300_QL70_ML2_.jpg;17;15;8;cm;1;kg
7898555216136;Fonte Gamer C3Tech PS-G500B, Preta,Certificacao 80 Plus Bronze 500w, ATX, PFC ativo Bivolt automatico 115/230V, Cooler 120mm;https://m.media-amazon.com/images/I/51IqZU0xIoL.__AC_SX300_SY300_QL70_ML2_.jpg;24,4;18,2;11;cm;1,4;kg
7898555217027;Fonte 500w C3Tech ATX Gamer PS-500BK Preto - Potência 500W Cooler 120mm Super Silêncioso Compatível com AMD/Intel Proteção contra Curto Circuito Bivolt Manual 115V/230V Sem Cabo AC;https://m.media-amazon.com/images/I/614TLLwdXFL.__AC_SX300_SY300_QL70_ML2_.jpg;23,2;21,2;12,2;cm;1,21;kg
7898555216143;Fonte 600w C3Tech ATX Gamer PS-G600B Preto - Potência 600W Cooler 120mm Silêncioso Compatível com AMD/Intel Selo 80Plus Bronze Proteção contra Curto Circuito Bivolt Automáico 115/230V PFC Ativo;https://m.media-amazon.com/images/I/61vPggxO90L.__AC_SX300_SY300_QL70_ML2_.jpg;24,6;18,4;11,2;cm;1,52;kg
7896637687850;FA 1220 S com bateria Fonte de alimentação ininterrupta Intelbras;https://m.media-amazon.com/images/I/41Kt1--grcL.__AC_SX300_SY300_QL70_ML2_.jpg;27;21;10;cm;2,5;kg
7896423502053;Fonte HDL TRA-400 Com Botão Para Acionamento de Fechadura;https://m.media-amazon.com/images/I/71q2rS71V6L.__AC_SX300_SY300_QL70_ML2_.jpg;14;10;6;cm;500;g
7896423500097;Fonte Tra-400, HDL, TRA 400 TRA 400, Preto;https://m.media-amazon.com/images/I/81ndNr9OnOL.__AC_SY300_SX300_QL70_ML2_.jpg;12,4;9,2;5,6;cm;456;g
7898554608031;Fonte Gamer ATX Crusader 500W Branca Fortrek;https://m.media-amazon.com/images/I/815JfCaVeCL.__AC_SX300_SY300_QL70_ML2_.jpg;21,2;16,6;9,8;cm;1;kg
7898554607331;Fonte Gamer ATX 500W Crusader Preta Fortrek;https://m.media-amazon.com/images/I/71gbP+wMcKL._AC_SY300_SX300_.jpg;20;16,7;9,8;cm;1,09;kg
7899298606055;Fonte Nobreak 12V 1A EFB 1201 Preto intelbras;https://m.media-amazon.com/images/I/41bGKdn2W0L.__AC_SX300_SY300_QL70_ML2_.jpg;12,3;7,8;6,7;cm;156;g
7897013566257;;;12;6;4;cm;280;g
7898554605528;Fonte ATX 200W PWS-2003 20+4P FK420P Fortrek;https://m.media-amazon.com/images/I/71I93LwUc3L.__AC_SX300_SY300_QL70_ML2_.jpg;16,5;16;9,1;cm;620;g
7899831313068;WAP Fritadeira Elétrica Air Fryer Barbecue Digital 12 em 1, 10 Litros, 4 Níveis de Temperatura, Antiaderente, 1700W 220V;https://m.media-amazon.com/images/I/71VfeAyCvaL.__AC_SX300_SY300_QL70_ML2_.jpg;52,4;47,8;37,6;cm;10,4;kg
7899831312719;WAP Fritadeira Elétrica Air Fryer FAMILY 4 Litros, Temperatura Ajustável, Duplo Revestimento Antiaderente, 1500W 220V;https://m.media-amazon.com/images/I/61wSZ93u49L.__AC_SX300_SY300_QL70_ML2_.jpg;37;32,7;28,3;cm;3,92;kg
7899831331840;WAP Fritadeira Elétrica Air Fryer FAMILY WAFF2-V 4 Litros, Vermelho, Revestimento Antiaderente, 1500W 220V;https://m.media-amazon.com/images/I/61VJLhggjUL.__AC_SX300_SY300_QL70_ML2_.jpg;41,5;33,3;31,3;cm;3,3;kg
7899831312795;WAP Fritadeira Elétrica Air Fryer OVEN DIGITAL 12 Litros, com 10 Funções, sem Óleo, Antiaderente, 2000W 220V;https://m.media-amazon.com/images/I/71ed4lXApLL.__AC_SX300_SY300_QL70_ML2_.jpg;45,6;44,8;42,8;cm;7,8;kg
7899831310258;"WAP Parafusadeira e Furadeira de Impacto 1/2"" EFPI-1000, com Empunhadura Emborracha e Maleta Organizadora, 1000W 220V";https://m.media-amazon.com/images/I/71wbKSlCk-L.__AC_SX300_SY300_QL70_ML2_.jpg;33;31,4;10;cm;2,3;kg
7899831331109;"WAP Parafusadeira e Furadeira de Impacto 3/8"" WF-700FE, com Chave de Mandril, Controle de Velocidade, 700W 220V";https://m.media-amazon.com/images/I/61GGmEpaK-L.__AC_SX300_SY300_QL70_ML2_.jpg;27,2;23,4;9,4;cm;1,2;kg
7898554606808;Gabinete Gamer Cruiser Mid Tower Preto RGB Fortrek;https://m.media-amazon.com/images/I/81xvqPpFyTL.__AC_SX300_SY300_QL70_ML2_.jpg;49,6;44;27,8;cm;4,34;kg
7898554607997;Gabinete Gamer Clarity Branco Lateral Vidro Fortrek;https://m.media-amazon.com/images/I/71VyxubJAAL.__AC_SX300_SY300_QL70_ML2_.jpg;42,8;41;33,7;cm;4,86;kg
7898554607980;Gabinete Gamer Clarity Preto Lateral Vidro Fortrek;https://m.media-amazon.com/images/I/81L6M0Zp9iL.__AC_SX300_SY300_QL70_ML2_.jpg;42,4;40,7;33,7;cm;4,83;kg
7899095438026;Gabinete Gamer Hayom, 4 Fans rgb, Lateral e Frontal Em Vidro Temperado, Preto - GB1749;https://m.media-amazon.com/images/I/51dj8CAGvcL.__AC_SX300_SY300_QL70_ML2_.jpg;47;37,3;24;cm;4;kg
7899838850924;Gabinete Gamer Modoc Painel Lateral Temperado Preto Warrior - GA178;https://m.media-amazon.com/images/I/5143G2-VK9L.__AC_SX300_SY300_QL70_ML2_.jpg;49,8;47,4;23,8;cm;4;kg
7898555215269;;;42,5;38;18,5;cm;3470;g
7898555216846;Gabinete Gamer C3Tech MT-G680SBK, Mid Tower, lateral em Vidro, Fitas de Led RGB frontais, Toolless, Organizador de cabos, Filtro anti-poeira, Compativel com Placa-Mãe ATX, Micro ATX, ITX, Preto;https://m.media-amazon.com/images/I/51yvWTOSteL.__AC_SX300_SY300_QL70_ML2_.jpg;51,3;42,9;26,1;cm;4,5;kg
7898555213418;Gabinete Gamer Mt-G70 Bk S/Fonte C3Tech, Preto, Médio;https://m.media-amazon.com/images/I/610pmAraPqL.__AC_SX300_SY300_QL70_ML2_.jpg;47,3;45;25,3;cm;2,74;kg
7898562619944;;;43,5;38,5;19;cm;4360;g
7898562619937;Gabinete Gamer ATX Iluminacao RGB Ajustavel OEX Game Preto;https://m.media-amazon.com/images/I/513NoEPK+XL._AC_SY300_SX300_.jpg;49,2;44,6;24,6;cm;5,17;kg
7898554606822;Gabinete Gamer Mid Tower HOLT RGB FORTREK;https://m.media-amazon.com/images/I/713Y8wLdiWL.__AC_SX300_SY300_QL70_ML2_.jpg;50;44,2;27,4;cm;3,9;kg
7898555219076;Gabinete C3Tech Gaming Preto MT-G80BK Mid Tower Organizador de cabos Screwless;https://m.media-amazon.com/images/I/41uDhOnNYOL.__AC_SX300_SY300_QL70_ML2_.jpg;45,9;45,2;25,1;cm;2,15;kg
7898555217034;Gabinete Micro ATX C3Tech, preto, com fonte 200w, MT-24V2BK;https://m.media-amazon.com/images/I/61cCMn9sAoL.__AC_SX300_SY300_QL70_ML2_.jpg;42,6;37,4;21,4;cm;2,7;kg
7898555217058;Gabinete Micro ATX C3Tech, preto, com fonte 200w, MT-25V2BK;https://m.media-amazon.com/images/I/61bxzqXTHLL.__AC_SX300_SY300_QL70_ML2_.jpg;42,5;37,5;21,2;cm;2,7;kg
7898555210561;C3TECH CH-200 USB 2.0 HD Capa, Preto;https://m.media-amazon.com/images/I/51Lg0cfxrFL.__AC_SX300_SY300_QL70_ML2_.jpg;15,2;10,2;3,6;cm;120;g
7898555210585;"Gaveta para HD externo 2.5"", USB 2.0, C3Tech - CH-200GY, 413060060202, Cinza";https://m.media-amazon.com/images/I/61GF8YBr32L.__AC_SX300_SY300_QL70_ML2_.jpg;15,8;11,4;5,4;cm;120;g
7898555210578;;;3,6;16,4;11,8;cm;120;g
7898555210547;Gaveta para HD USB 3.0 CH-300BK, C3TECH;https://m.media-amazon.com/images/I/7121zdGEZJL.__AC_SX300_SY300_QL70_ML2_.jpg;16;11,2;5,6;cm;120;g
7898907620215;;;7,8;12;1,2;cm;45;g
7898907620116;"C3Tech Gaveta para HD Externo CH-C300BK Preto 2,5"" SATA USB-C 3.0 suporta até 6TB fabricado em plástico PC Tool Less";https://m.media-amazon.com/images/I/41W45bTXz0L.__AC_SX300_SY300_QL70_ML2_.jpg;15,5;11,8;3,6;cm;55;g
7898378255305;Gaveta de Dinheiro Bematech GD-36;https://m.media-amazon.com/images/I/411Pj7q5srL.__AC_SX300_SY300_QL70_ML2_.jpg;47;46,8;15,8;cm;7301;g
7896637631518;Organizador de cabos 1U OCH1U 40 Intelbras;https://m.media-amazon.com/images/I/41VDC8EvDYS.__AC_SY300_SX300_QL70_ML2_.jpg;9;5;5;cm;400;g
7896637631501;ORGANIZADOR DE CABOS HORIZONTAL INTELBRAS 1U OCH1U 80MM PARA RACK;https://m.media-amazon.com/images/I/41E4D3S7RkS.__AC_SX300_SY300_QL70_ML2_.jpg;49,5;10;6,5;cm;811;g
7896637656535;;;2,61;14,7;10,16;cm;0,68;g
7896637666022;Disco Rígido Wd Purple 6Tb - Wd60Purz Intelbras, HD interno, Roxo;https://m.media-amazon.com/images/I/21-06wWGGJL.__AC_QL70_ML2_.jpg;15;10,8;4;cm;0,75;g
7896637673457;Hd Interno Wd Purple Sata 128mb 8 Tera WD80PURX Intelbras;https://m.media-amazon.com/images/I/61zRvRPc1oL.__AC_SX300_SY300_QL70_ML2_.jpg;25;25;10;cm;900;g
7896637625227;Fone de Ouvido Headset Bluetooh WHS 80 BT Preto Intelbras;https://m.media-amazon.com/images/I/417X7BwDy7L.__AC_SX300_SY300_QL70_ML2_.jpg;22,4;16,2;4,4;cm;159;g
7896637631563;Fone de Ouvido Headset USB CHS 40 Preto Intelbras;https://m.media-amazon.com/images/I/417Jf4FEG+L._AC_SY300_SX300_.jpg;15,4;13,2;5,8;cm;160;g
7898554605733;Fortrek H2 - Headset Gamer Pro Microfones e Fones de Ouvido, Preto (Leds Azul);https://m.media-amazon.com/images/I/715099pgIPL.__AC_SX300_SY300_QL70_ML2_.jpg;24,9;20,9;11,4;cm;500;g
7898554606792;Headset Gamer RGB Vickers Preto Fortrek;https://m.media-amazon.com/images/I/51DQ0wBq1gL.__AC_SX300_SY300_QL70_ML2_.jpg;23,4;19,4;9,8;cm;505;g
7897982207342;Bright, Headset Gamer Conexão USB Com Tecnologia 7.1 Simulação Som Virtual Surround na Cor Preto e com Luzes LED, Com Protetor de Ouvido Almofadado, Possui Controle de Volume e Microfone Embutido;https://m.media-amazon.com/images/I/61JrL-ay34L.__AC_SX300_SY300_QL70_ML2_.jpg;24,8;20,8;13,8;cm;530;g
7896637687003;Headset Mono CHS 40 RJ9 Preto Intelbras;https://m.media-amazon.com/images/I/41DdhrKJ0SL.__AC_SX300_SY300_QL70_ML2_.jpg;18,4;15,6;6,2;cm;190;g
7896637677035;Headset USB Intelbras THS 55;https://m.media-amazon.com/images/I/41GBSVK4faL.__AC_SX300_SY300_QL70_ML2_.jpg;20;18,2;6;cm;0,1;g
7898562615878;Oex HS403 Headset Armor;https://m.media-amazon.com/images/I/51QHybiIvoL.__AC_SX300_SY300_QL70_ML2_.jpg;20,8;17,8;8,6;cm;255;g
7898595272864;Headset Bluetooth OEX Balance HS301 - Branco;https://m.media-amazon.com/images/I/51CbKeaE8WL.__AC_SX300_SY300_QL70_ML2_.jpg;24,8;20,8;9,4;cm;178;g
7898595272857;HS301 Headset Balance Preto - Oex;https://m.media-amazon.com/images/I/51UH8BhFeZL.__AC_SX300_SY300_QL70_ML2_.jpg;26;22;8,6;cm;178;g
7898562615557;Fone De Ouvido Com Microfone Oex Hs207 Flow Preto;https://m.media-amazon.com/images/I/41a86l3IYPL.__AC_SX300_SY300_QL70_ML2_.jpg;18,6;18;10,6;cm;230;g
7898595270174;Headset Gamer Action Oex Hs200 Conector P2 Preto E Laranja;https://m.media-amazon.com/images/I/415ayvh5RbL.__AC_SX300_SY300_QL70_ML2_.jpg;25,6;20;9,4;cm;340;g
7898595272925;Headset Bit, OEX, Microfones e Fones de Ouvido, Preto/Azul;https://m.media-amazon.com/images/I/410dt0n0DmL.__AC_SX300_SY300_QL70_ML2_.jpg;24,6;21,2;10,4;cm;215;g
7898587270946;Headset Gamer Multiplataforma Gorky Oex Hs413 Preto;https://m.media-amazon.com/images/I/51I-CMG1S0L.__AC_SX300_SY300_QL70_ML2_.jpg;26,4;22,4;10,4;cm;255;g
7898554607768;Headset Office FK731A USB Preto Fortrek;https://m.media-amazon.com/images/I/61lSpvmo0HL.__AC_SX300_SY300_QL70_ML2_.jpg;22;15;0,4;cm;140;g
7899744060219;5+ Headset Office para Telefone com Conector RJ9, 015-0100, 5+;https://m.media-amazon.com/images/I/411HXG0Y9CL.__AC_SX300_SY300_QL70_ML2_.jpg;18,6;15;5,2;cm;100;g
7899744060233;5+ HEADSET OFFICE CHIP SCE P/TELEFONE E COMPUTADOR C/USB C - 015-0102;https://m.media-amazon.com/images/I/514E3Yra3cL.__AC_SX300_SY300_QL70_ML2_.jpg;18,2;14,8;5,2;cm;110;g
7898554601476;Hub 4 Portas, Fortrek;https://m.media-amazon.com/images/I/51PPQVMbiUS.__AC_SX300_SY300_QL70_ML2_.jpg;17,4;12,8;5,2;cm;70;g
7898554601483;Hub 4 Portas, Fortrek;https://m.media-amazon.com/images/I/61l2ZFFOQJL.__AC_SX300_SY300_QL70_ML2_.jpg;18,4;11,2;2,2;cm;60;g
7898562690738;;;16;14;10;cm;200;g
7898476325344;Hub 4 Portas Multilaser Flexível 2.0 Preto - AC042;https://m.media-amazon.com/images/I/510NrMfUYiL.__AC_SX300_SY300_QL70_ML2_.jpg;17,8;10,6;3;cm;0,1;g
7898907620598;C3Tech Hub USB 2.0 5 Portas HU-L200BK Preto USB 2.0-3 entradas USB, 1 entrada de Cartão de memória SD e 1 entrada de cartão de memoria TF/Micro SD;https://m.media-amazon.com/images/I/41iptP4iVrL.__AC_SX300_SY300_QL70_ML2_.jpg;17;11;4;cm;30;g
7898562690653;Hub Usb 2.0 7 Portas Slim Comtac 9249;https://m.media-amazon.com/images/I/41dnSpnbW8S.__AC_SX300_SY300_QL70_ML2_.jpg;17,5;12,8;6,4;cm;161;g
7898506454136;Hub Multilaser Usb 3 Portas + Leitor De Cartão 2.0 - AC121;https://m.media-amazon.com/images/I/61eM6lX3wAL.__AC_SX300_SY300_QL70_ML2_.jpg;18,8;12,6;4,4;cm;0,2;g
7897975068196;Hub 5 Portas Usb Ps4 Dazz, Outros acessórios para notebooks;https://m.media-amazon.com/images/I/61FCgNw-50L.__AC_SY300_SX300_QL70_ML2_.jpg;18,2;11,4;4,8;cm;0,25;g
7899838816500;Hub USB 4 Portas 3,0 Super Speed Multi - AC289;https://m.media-amazon.com/images/I/511YjmZSACL.__AC_SY300_SX300_QL70_ML2_.jpg;22,2;13,2;2,8;cm;75;g
7898700014501;ELG, HUB41A-V2, Adaptador HUB USB 4 em 1, Entrada Tipo-C, Com 4 Saídas USB-A, UBS 2.0 e 3.0, Velocidade Até 5Gbps, Fabricado em Alumínio, Cinza;https://m.media-amazon.com/images/I/41G5CSLFmoL.__AC_SX300_SY300_QL70_ML2_.jpg;15,8;10;0,4;cm;40;g
7898587273633;Distribuidor de Conexão HUB Type C para USB OEX HB104 - Chumbo;https://m.media-amazon.com/images/I/31suYde2dKL.__AC_SX300_SY300_QL70_ML2_.jpg;14;7,5;2;cm;240;g
7898587273657;Distribuidor de Conexão HUB USB-C 3.0 OEX HB103 - Preto;https://m.media-amazon.com/images/I/41x4iYL7fBL.__AC_SX300_SY300_QL70_ML2_.jpg;14;7,5;2;cm;28;g
7898562690806;Hub USB + Leitor de Cartao SD + Carregador Micro USB - COMTAC - 9264;https://m.media-amazon.com/images/I/41Q9528lSPS.__AC_SX300_SY300_QL70_ML2_.jpg;20;18;11;cm;300;g
7897982207427;Bright HUB USB 4 PORTAS 3.0;https://m.media-amazon.com/images/I/51A0lju-eSL.__AC_SX300_SY300_QL70_ML2_.jpg;17;11;1;cm;100;g
7897075810329;Impressora de Cheques Checkprinter II, USB - Bivolt;https://m.media-amazon.com/images/I/51bZJOA1zdL.__AC_SX300_SY300_QL70_ML2_.jpg;29,8;27,4;18,6;cm;3,5;kg
7897013581465;Impressora Térmica, Elgin, Não Fiscal, I/8, Full-Usb, Ethernet, Preto, 46I8USECKD00;https://m.media-amazon.com/images/I/51aaKAu72gL.__AC_SX300_SY300_QL70_ML2_.jpg;27;25,8;23,5;cm;2,4;kg
7897013572821;Impressora Térmica Não Fiscal com Guilhotina i9 USB - Elgin;https://m.media-amazon.com/images/I/51gyUwaLnIL.__AC_SX300_SY300_QL70_ML2_.jpg;27;24;23;cm;2,7;kg
7897013570964;Impressora Térmica para Recibo e NFC-e Elgin I9 com Guilhotina - USB e Ethernet;https://m.media-amazon.com/images/I/51eYvEWVthL.__AC_SX300_SY300_QL70_ML2_.jpg;33;22;20;cm;2,6;kg
7897013570889;Elgin Impressora Térmica Nao Fiscal i9 Vox, Preto;https://m.media-amazon.com/images/I/91X5n-qhMLL.__AC_SY300_SX300_QL70_ML2_.jpg;32,4;22,8;20;cm;18;g
7897013517679;Impressora não fiscal I9 Full Bematech USB Ser. ETH;https://m.media-amazon.com/images/I/51M8nAk6kfL.__AC_SX300_SY300_QL70_ML2_.jpg;28;27;24;cm;1,8;kg
7897013517723;IMPRESSORA DE ETIQUETAS ELGIN L42PRO 203DPI USB E ETHERNET;https://m.media-amazon.com/images/I/51SrQNvjIEL.__AC_SX300_SY300_QL70_ML2_.jpg;28,6;26,6;26,4;cm;1,5;kg
7897013517730;Impressora Termica L42pro Etiquetas 203dpi Usb;https://m.media-amazon.com/images/I/41I4HrNlRDL._SY445_SX342_QL70_ML2_.jpg;33;25;20;cm;3;kg
7899298611172;Interface Wi-Fi para Videoporteiro Allo Box Branco Intelbras;https://m.media-amazon.com/images/I/31xw7MbilfL.__AC_SX300_SY300_QL70_ML2_.jpg;15;10,2;3,6;cm;500;g
7896637640022;Tomada Inteligente Smart Wi-Fi EWS 301 Branco;https://m.media-amazon.com/images/I/21BiKKdwQjL.__AC_SX300_SY300_QL70_ML2_.jpg;8,6;6,5;4,4;cm;78;g
7896637602358;Interruptor Controlador de Cargas Izy Smart Wi-Fi EWS 201 E Branco Intelbras;https://m.media-amazon.com/images/I/41HTBFurNsL.__AC_SX300_SY300_QL70_ML2_.jpg;8,8;3,8;3;cm;250;g
7899298605706;;;4,6;4,6;1,88;cm;40;g
7899298606475;Mini Controlador de Carga Inteligente Wi-fi Izy Smart intelbras EWS 222 Branco;https://m.media-amazon.com/images/I/51db4p6PjdL.__AC_SX300_SY300_QL70_ML2_.jpg;5,8;5;3;cm;40;g
7899298605720;Interruptor Inteligente Izy Smart Soquete intelbras E27 EWS 400 Branco;https://m.media-amazon.com/images/I/61QmzuHci5L.__AC_SX300_SY300_QL70_ML2_.jpg;9,8;5,8;5,6;cm;54;g
7896637679695;Sensor de Presença com Soquete ESP 360 S Branco Intelbras;https://m.media-amazon.com/images/I/41hClZqn12L.__AC_SX300_SY300_QL70_ML2_.jpg;18;12;8;cm;100;g
7896637695176;;;15;13;4;cm;150;g
7899298651062;;;7,5;5,6;5,3;cm;100;g
7899298650812;;;3,6;10,7;10,7;cm;120;g
7896637695190;Interruptor Sensor de Presença para Iluminação ESPI 360 A Branco Intelbras;https://m.media-amazon.com/images/I/31AmcrnuN0L.__AC_SX300_SY300_QL70_ML2_.jpg;21;16;5;cm;110;g
7896637680097;Sensor de Presença para Iluminação ESP 180 AE Branco;https://m.media-amazon.com/images/I/41h2F+WQF6L._AC_SY300_SX300_.jpg;23;16,4;7,4;cm;500;g
7896637679756;intelbras Sensor de Presença para Iluminação ESP 180 E+ Branco;https://m.media-amazon.com/images/I/51xRuFOMMLL.__AC_SX300_SY300_QL70_ML2_.jpg;21;13;4,6;cm;0,09;g
7896637679749;Sensor de Presença para Iluminação, Intelbras, ESP 360, Branco;https://m.media-amazon.com/images/I/519UP+VwI2L._AC_SY300_SX300_.jpg;20,2;16,8;4,4;cm;0,11;g
7896637680066;Sensor de Presença para Iluminação ESP 360 + Branco Intelbras;https://m.media-amazon.com/images/I/41YupaINiPL.__AC_SX300_SY300_QL70_ML2_.jpg;22;16,4;7;cm;0,12;g
7896637682091;Interruptor Sensor de Presença para Iluminação, Intelbras 360 E;https://m.media-amazon.com/images/I/41XK9MKnVnL.__AC_SX300_SY300_QL70_ML2_.jpg;20;16,7;8;cm;0,08;g
7899298652984;Interruptor Smart Wi-Fi Touch Compatível com Alexa Com 4 Teclas EWS 1004 Branco Intelbras;https://m.media-amazon.com/images/I/311PwEKwGgL.__AC_SX300_SY300_QL70_ML2_.jpg;13,3;12,3;4,3;cm;165;g
7899298652991;Interruptor Touch Inteligente Compatível com Alexa 4 Teclas EWS 1004 Preto Intelbras;https://m.media-amazon.com/images/I/31QaWQrwgAL.__AC_SX300_SY300_QL70_ML2_.jpg;13,6;12,4;4,6;cm;165;g
7899298638629;Interruptor Touch Inteligente, Compatível com Alexa, EWS 1101 Preto, Intelbras;https://m.media-amazon.com/images/I/31amOc62UDL.__AC_SX300_SY300_QL70_ML2_.jpg;14,2;9,4;5,2;cm;240;g
7899298653004;Intelbras, EWS 1006, Interruptor Touch Smart Wi-Fi com 6 teclas, Branco;https://m.media-amazon.com/images/I/31g9+QMqW6L._AC_SY300_SX300_.jpg;13,6;12,6;4,4;cm;550;g
7899298653103;Interruptor Smart Wi-Fi Touch Compatível com Alexa 6 Teclas EWS 1006 Preto Intelbras;https://m.media-amazon.com/images/I/41iVtzdf87L.__AC_SX300_SY300_QL70_ML2_.jpg;13,6;12,6;4,6;cm;40;g
7899298620709;Interruptor Touch Inteligente Compatível com Alexa Com 1 Tecla Compatível com Alexa EWS 1001 Preto Intelbras;https://m.media-amazon.com/images/I/51Q7smBsSnL.__AC_SX300_SY300_QL70_ML2_.jpg;14,4;8,4;4,5;cm;165;g
7899298620648;Interruptor Touch Inteligente Compatível Com Alexa Com 2 Teclas EWS 1002 Branco Intelbras;https://m.media-amazon.com/images/I/51ZLRyL29IL.__AC_SX300_SY300_QL70_ML2_.jpg;14,4;8,4;5;cm;165;g
7899298620655;;;7,2;3,9;11,8;cm;165;g
7899298620570;Interruptor Touch Inteligente Compatível Com Alexa Com 3 Teclas EWS 1003 Branco Intelbras;https://m.media-amazon.com/images/I/51K1C3EGxJL.__AC_SX300_SY300_QL70_ML2_.jpg;14;9;5;cm;165;g
7899298620624;Interruptor Touch Inteligente Compatível Com Alexa Com 3 Teclas EWS 1003 Preto Intelbras;https://m.media-amazon.com/images/I/31aDRzQ1LYL.__AC_SX300_SY300_QL70_ML2_.jpg;14,6;8,6;5;cm;165;g
7899838822990;Irrigador Oral Clearpik Portable 200ml Recarregável Multi Saúde - HC036;https://m.media-amazon.com/images/I/41fgVKfEqjL.__AC_SX300_SY300_QL70_ML2_.jpg;25;16;9,2;cm;0,58;g
7896637674133;ISOLADOR DE LAÇO Intelbras IDL 520;https://m.media-amazon.com/images/I/5126HNVtoqL.__AC_SY300_SX300_QL70_ML2_.jpg;20;20;20;cm;150;g
7897013561276;Carregador USB de Tomada + Carregador Veicular 1 Saída 1A 5W + Cabo MicroUSB de 1 Metro Elgin Branco Bivolt;https://m.media-amazon.com/images/I/41k5uUnmEwL.__AC_SY300_SX300_QL70_ML2_.jpg;13,8;9,4;2,6;cm;53;g
7898566591185;Kit Cabo Rg59 40% 15mts (exclusivo Kits Indiv. 44775/44776) Century;https://m.media-amazon.com/images/I/41CIzP8bgfL.__AC_SY300_SX300_QL70_ML2_.jpg;32;32;10;cm;4,51;kg
7899831333493;WAP Kit de Ferramentas Manuais WF M110 em Cromo Vanádio, com 110 Peças e Maleta Organizadora;https://m.media-amazon.com/images/I/91IpqRJmM0L.__AC_SX300_SY300_QL70_ML2_.jpg;42,9;41,1;8,6;cm;6,95;kg
7896637648370;;;0,92;0,24;0,14;cm;3,55;g
7899838807171;Kit Teclado e Mouse sem fio Slim Multi conexão USB Preto - TC202;https://m.media-amazon.com/images/I/51SHKP6MZFL.__AC_SY300_SX300_QL70_ML2_.jpg;41,6;11,4;4,4;cm;420;g
7899838887456;KIT TECLADO E MOUSE SEM FIO TC251;https://m.media-amazon.com/images/I/41PwQ3s3NiL.__AC_SX300_SY300_QL70_ML2_.jpg;51,1;18,5;5;cm;570;g
7898555213661;Combo C3Tech sem Fio K-W10BK Preto, Teclado e Mouse, Incluso Receptor Nano USB 1 Pilha AA e 2 Pilhas AAA Layout ABNT2 Multimidia, Mouse Ambidestro;https://m.media-amazon.com/images/I/61GEGDQKF-L.__AC_SX300_SY300_QL70_ML2_.jpg;52,4;16,2;4,4;cm;430;g
7898555218666;C3Tech Combo Teclado e Mouse sem fio Preto K-W100BK - Layout ABNT2 Multimídia, Anti Respingo, teclas de atalho multimidia oferece alto desempenho e durabilidade, MacOS, Linux, PC;https://m.media-amazon.com/images/I/41TUNu9lb4L.__AC_SX300_SY300_QL70_ML2_.jpg;52,8;15,2;4;cm;440;g
7898555218567;C3Tech combo Teclado e Mouse sem fio K-W60BK preto wifi layout ABNT2 ambidestro DPI ajustavel 12 teclas de atalho multimidia anti respingo regulagem de altura Slim receptor Nano USB;https://m.media-amazon.com/images/I/51ONJ08xSSL.__AC_SX300_SY300_QL70_ML2_.jpg;54,4;20,7;5,1;cm;435;g
7898491460341;Teclado + Mouse Optico sem Fio 1000DPI K-W600BK Preto C3 TECH;https://m.media-amazon.com/images/I/61z7yGVplQL.__AC_SX300_SY300_QL70_ML2_.jpg;52;14;5;cm;700;g
7898555213364;;;44,2;2,2;15,7;cm;700;g
7897013573354;Kit Veicular Powerbank 3000mAh, Suporte Veicular, Carregador USB Veicular 2 Saídas 2.1A 10W, Cabo microUSB Elgin, Elgin, 46RKITCARRO0, Branco, Cinza;https://m.media-amazon.com/images/I/51F72kvO5oL.__AC_SX300_SY300_QL70_ML2_.jpg;19,4;16,8;3,8;cm;175;g
7898506460526;;;20;20;20;cm;500;g
7897013572876;Lampada Bulbo Led A55 6w Bivolt 6500k Elgin;https://m.media-amazon.com/images/I/51IabNueDJL.__AC_SX300_SY300_QL70_ML2_.jpg;11;5,6;5,6;cm;30;g
7897013572890;Lampada Bulbo Led A60 9w Bivolt 6500k Elgin;https://m.media-amazon.com/images/I/31zDPp-KbLL.__AC_SY300_SX300_QL70_ML2_.jpg;11,2;6,1;6,1;cm;54;g
7897013589164;;;6,6;1,8;1,8;cm;180;g
